{
  "$schema": "https://json-schema.org/draft/2020-12/schema",
  "$id": "https://ophiolite.dev/contracts/assets/v1/time-depth-schema.json",
  "x-ophiolite": {
    "id": "ophiolite.time-depth/1",
    "version": "1.0.0",
    "lifecycle": "preview"
  },
  "$defs": {
    "Fidelity": {
      "additionalProperties": false,
      "properties": {
        "status": {
          "const": "assessed",
          "title": "Status",
          "type": "string"
        },
        "preserved": {
          "items": {
            "maxLength": 512,
            "minLength": 1,
            "type": "string"
          },
          "maxItems": 16,
          "title": "Preserved",
          "type": "array"
        },
        "losses": {
          "items": {
            "maxLength": 512,
            "minLength": 1,
            "type": "string"
          },
          "maxItems": 16,
          "title": "Losses",
          "type": "array"
        },
        "unknown_context": {
          "items": {
            "maxLength": 128,
            "minLength": 1,
            "type": "string"
          },
          "maxItems": 16,
          "title": "Unknown Context",
          "type": "array"
        },
        "decisions": {
          "anyOf": [
            {
              "items": {
                "maxLength": 512,
                "minLength": 1,
                "type": "string"
              },
              "maxItems": 64,
              "type": "array"
            },
            {
              "type": "null"
            }
          ],
          "default": null,
          "title": "Decisions"
        }
      },
      "required": [
        "status",
        "preserved",
        "losses",
        "unknown_context"
      ],
      "title": "Fidelity",
      "type": "object"
    },
    "Reference": {
      "additionalProperties": false,
      "properties": {
        "authority": {
          "maxLength": 512,
          "minLength": 1,
          "title": "Authority",
          "type": "string"
        },
        "key": {
          "maxLength": 512,
          "minLength": 1,
          "title": "Key",
          "type": "string"
        },
        "revision": {
          "maxLength": 512,
          "minLength": 1,
          "title": "Revision",
          "type": "string"
        },
        "profile": {
          "maxLength": 128,
          "pattern": "^[a-z0-9][a-z0-9.-]*(/[a-z0-9.-]+)*/[0-9]+$",
          "title": "Profile",
          "type": "string"
        }
      },
      "required": [
        "authority",
        "key",
        "revision",
        "profile"
      ],
      "title": "Reference",
      "type": "object"
    },
    "TimeDepthContext": {
      "additionalProperties": false,
      "properties": {
        "type": {
          "const": "time-depth",
          "title": "Type",
          "type": "string"
        },
        "depth_type": {
          "enum": [
            "md",
            "tvd",
            "tvdss",
            "unknown"
          ],
          "title": "Depth Type",
          "type": "string"
        },
        "depth_unit": {
          "pattern": "^([A-Za-z0-9 ./^()\\-]{1,32}|unknown)$",
          "title": "Depth Unit",
          "type": "string"
        },
        "time_kind": {
          "enum": [
            "one-way",
            "two-way",
            "unknown"
          ],
          "title": "Time Kind",
          "type": "string"
        },
        "time_unit": {
          "enum": [
            "ms",
            "s",
            "us",
            "unknown"
          ],
          "title": "Time Unit",
          "type": "string"
        },
        "datum": {
          "anyOf": [
            {
              "maxLength": 128,
              "minLength": 1,
              "type": "string"
            },
            {
              "type": "null"
            }
          ],
          "title": "Datum"
        },
        "seismic_reference_elevation": {
          "anyOf": [
            {
              "type": "number"
            },
            {
              "type": "null"
            }
          ],
          "title": "Seismic Reference Elevation"
        },
        "count": {
          "maximum": 100000,
          "minimum": 2,
          "title": "Count",
          "type": "integer"
        },
        "depth_range": {
          "items": {
            "type": "number"
          },
          "maxItems": 2,
          "minItems": 2,
          "title": "Depth Range",
          "type": "array"
        },
        "time_range": {
          "items": {
            "type": "number"
          },
          "maxItems": 2,
          "minItems": 2,
          "title": "Time Range",
          "type": "array"
        },
        "velocity_provided": {
          "title": "Velocity Provided",
          "type": "boolean"
        },
        "fidelity": {
          "$ref": "#/$defs/Fidelity"
        }
      },
      "required": [
        "type",
        "depth_type",
        "depth_unit",
        "time_kind",
        "time_unit",
        "datum",
        "seismic_reference_elevation",
        "count",
        "depth_range",
        "time_range",
        "velocity_provided",
        "fidelity"
      ],
      "title": "TimeDepthContext",
      "type": "object"
    },
    "TypedInterpretation": {
      "additionalProperties": false,
      "description": "The executable identity of the typed reader (Connectors typed_reader; E56: feature_files for feature sets).",
      "properties": {
        "reader": {
          "enum": [
            "asset_connectors.typed_reader/1",
            "asset_connectors.feature_files/1"
          ],
          "title": "Reader",
          "type": "string"
        },
        "mapping": {
          "enum": [
            "well-tops/1",
            "trajectory/1",
            "regular-grid-surface/1",
            "triangulated-surface/1",
            "point-set/1",
            "polyline-set/1",
            "seismic-volume/1",
            "well-location/1",
            "wavelet/1",
            "model-section/1",
            "seismic-section/1",
            "time-depth/1",
            "feature-set/1",
            "well-path/1",
            "well-set/1",
            "well-residual/1"
          ],
          "title": "Mapping",
          "type": "string"
        },
        "parsing_policy": {
          "const": "typed-strict/1",
          "title": "Parsing Policy",
          "type": "string"
        },
        "null_policy": {
          "maxLength": 512,
          "minLength": 1,
          "title": "Null Policy",
          "type": "string"
        }
      },
      "required": [
        "reader",
        "mapping",
        "parsing_policy",
        "null_policy"
      ],
      "title": "TypedInterpretation",
      "type": "object"
    }
  },
  "additionalProperties": false,
  "description": "E57: depth and time pairs in file order, both strictly increasing, with the velocity column as stated (null where empty).\nNo interpolation, conversion or datum default.",
  "properties": {
    "representation": {
      "const": "normalized",
      "title": "Representation",
      "type": "string"
    },
    "source": {
      "$ref": "#/$defs/Reference"
    },
    "source_sha256": {
      "pattern": "^[0-9a-f]{64}$",
      "title": "Source Sha256",
      "type": "string"
    },
    "interpretation": {
      "$ref": "#/$defs/TypedInterpretation"
    },
    "schema": {
      "const": "ophiolite.time-depth/1",
      "title": "Schema",
      "type": "string"
    },
    "context": {
      "$ref": "#/$defs/TimeDepthContext"
    },
    "depth": {
      "items": {
        "type": "number"
      },
      "maxItems": 100000,
      "minItems": 2,
      "title": "Depth",
      "type": "array"
    },
    "time": {
      "items": {
        "type": "number"
      },
      "maxItems": 100000,
      "minItems": 2,
      "title": "Time",
      "type": "array"
    },
    "velocity": {
      "anyOf": [
        {
          "items": {
            "anyOf": [
              {
                "type": "number"
              },
              {
                "type": "null"
              }
            ]
          },
          "maxItems": 100000,
          "type": "array"
        },
        {
          "type": "null"
        }
      ],
      "default": null,
      "title": "Velocity"
    }
  },
  "required": [
    "representation",
    "source",
    "source_sha256",
    "interpretation",
    "schema",
    "context",
    "depth",
    "time"
  ],
  "title": "TimeDepth",
  "type": "object"
}
